{
  "$schema": "https://json-schema.org/draft/2020-12/schema",
  "$id": "d20.integrity.cvx_trace.v1",
  "title": "D20 C/V/X sector-interface trace",
  "type": "object",
  "required": [
    "schema",
    "status",
    "trace_id",
    "source",
    "integrity_model",
    "events",
    "summary"
  ],
  "properties": {
    "schema": {
      "const": "d20.integrity.cvx_trace.v1"
    },
    "status": {
      "enum": [
        "CVX_TRACE_REPLAY_WITNESS",
        "CVX_TRACE_SCHEMA_FIXTURE",
        "CVX_SOLVER_EXECUTION_TRACE_WITNESS"
      ]
    },
    "trace_id": {
      "type": "string",
      "minLength": 1
    },
    "source": {
      "type": "object",
      "required": [
        "proof_format",
        "cnf_path",
        "cnf_sha256",
        "classifier_source"
      ],
      "properties": {
        "proof_format": {
          "enum": [
            "lrat",
            "drat",
            "frat",
            "solver_opcode"
          ]
        },
        "proof_path": {
          "type": "string",
          "minLength": 1
        },
        "proof_sha256": {
          "type": "string",
          "pattern": "^[0-9a-f]{64}$"
        },
        "cnf_path": {
          "type": "string",
          "minLength": 1
        },
        "cnf_sha256": {
          "type": "string",
          "pattern": "^[0-9a-f]{64}$"
        },
        "classifier_source": {
          "type": "string",
          "minLength": 1
        }
      },
      "additionalProperties": false
    },
    "integrity_model": {
      "type": "object",
      "required": [
        "allowed_types",
        "accepted_public_types",
        "unsupported_event_policy"
      ],
      "properties": {
        "allowed_types": {
          "type": "array",
          "items": {
            "enum": [
              "C",
              "V",
              "X",
              "UNCLASSIFIED"
            ]
          },
          "minItems": 4,
          "uniqueItems": true
        },
        "accepted_public_types": {
          "type": "array",
          "items": {
            "const": "C"
          },
          "minItems": 1,
          "maxItems": 1
        },
        "unsupported_event_policy": {
          "const": "reject_or_emit_typed_residue"
        }
      },
      "additionalProperties": false
    },
    "events": {
      "type": "array",
      "minItems": 1,
      "items": {
        "type": "object",
        "required": [
          "event_id",
          "line",
          "op",
          "integrity_type",
          "class_code",
          "public_inputs",
          "public_outputs",
          "checks"
        ],
        "properties": {
          "event_id": {
            "type": "string",
            "minLength": 1
          },
          "line": {
            "type": "integer",
            "minimum": 1
          },
          "proof_id": {
            "type": "integer",
            "minimum": 1
          },
          "op": {
            "enum": [
              "add",
              "delete",
              "solver_opcode",
              "residue"
            ]
          },
          "integrity_type": {
            "enum": [
              "C",
              "V",
              "X",
              "UNCLASSIFIED"
            ]
          },
          "class_code": {
            "type": "string",
            "minLength": 1
          },
          "reason": {
            "type": "string"
          },
          "public_inputs": {
            "type": "object",
            "required": [
              "clause_hints",
              "literals"
            ],
            "properties": {
              "clause_hints": {
                "type": "array",
                "items": {
                  "type": "integer"
                }
              },
              "literals": {
                "type": "array",
                "items": {
                  "type": "integer"
                }
              }
            },
            "additionalProperties": false
          },
          "public_outputs": {
            "type": "object",
            "required": [
              "clause_id",
              "literal_count",
              "empty_clause"
            ],
            "properties": {
              "clause_id": {
                "type": "integer",
                "minimum": 1
              },
              "literal_count": {
                "type": "integer",
                "minimum": 0
              },
              "empty_clause": {
                "type": "boolean"
              }
            },
            "additionalProperties": false
          },
          "checks": {
            "type": "object",
            "required": [
              "uses_extension_variable",
              "has_duplicate_literal",
              "contains_complement_pair",
              "locally_checkable"
            ],
            "properties": {
              "uses_extension_variable": {
                "type": "boolean"
              },
              "has_duplicate_literal": {
                "type": "boolean"
              },
              "contains_complement_pair": {
                "type": "boolean"
              },
              "locally_checkable": {
                "type": "boolean"
              }
            },
            "additionalProperties": false
          }
        },
        "additionalProperties": false
      }
    },
    "summary": {
      "type": "object",
      "required": [
        "event_count",
        "integrity_counts",
        "verdict",
        "all_events_classified",
        "pure_c_trace"
      ],
      "properties": {
        "event_count": {
          "type": "integer",
          "minimum": 1
        },
        "integrity_counts": {
          "type": "object",
          "required": [
            "C",
            "V",
            "X",
            "UNCLASSIFIED"
          ],
          "properties": {
            "C": {
              "type": "integer",
              "minimum": 0
            },
            "V": {
              "type": "integer",
              "minimum": 0
            },
            "X": {
              "type": "integer",
              "minimum": 0
            },
            "UNCLASSIFIED": {
              "type": "integer",
              "minimum": 0
            }
          },
          "additionalProperties": false
        },
        "verdict": {
          "type": "string",
          "minLength": 1
        },
        "all_events_classified": {
          "type": "boolean"
        },
        "pure_c_trace": {
          "type": "boolean"
        }
      },
      "additionalProperties": false
    }
  },
  "additionalProperties": false
}
